{"type":"config","name":"Optimize diffusion raw box loss","metricName":"mean_raw_box_loss","metricUnit":"","bestDirection":"lower"}
{"run":1,"commit":"640666d","metric":0.35285068,"metrics":{"max_training_s":1.049346042,"mean_training_s":0.6546807776666667,"noise_loss":0.9578457},"status":"keep","description":"Baseline raw denoising box loss harness","timestamp":1779990189982,"segment":0,"confidence":null,"asi":{"hypothesis":"Current DDPM baseline raw outputs remain far from nearest valid boxes; initial max_training_s includes compilation for non-Gaussian process and benchmark needs better warmup before enforcing the <1s gate.","next_action_hint":"Warm all process training paths before timing, then optimize raw box loss while keeping post-warmup max_training_s under 1s."}}
{"run":2,"commit":"warmup","metric":0.35285068,"metrics":{"max_training_s":0.315886583,"mean_training_s":0.2641540276666667,"noise_loss":0.9578457},"status":"discard","description":"Warm all process training paths before timing","timestamp":1779990223592,"segment":0,"confidence":null,"asi":{"hypothesis":"The >1s baseline training time was a compile artifact; warming Gaussian, StudentT, and Cauchy paths isolates post-warmup training time.","learned":"Post-warmup max_training_s is about 0.316s, comfortably under the 1s gate; primary raw box loss is unchanged.","rollback_reason":"Primary metric did not improve; only the harness timing was clarified.","next_action_hint":"Suppress warmup return-value printing in autoresearch.sh, then try model/training changes that reduce raw box loss without pushing max_training_s above 1s."}}
{"run":3,"commit":"3e5b132","metric":0.1886763,"metrics":{"max_training_s":0.736043,"mean_training_s":0.7059730833333333,"noise_loss":0.63716984},"status":"keep","description":"Train DDPM for three dataset passes per model","timestamp":1779990280095,"segment":0,"confidence":null,"asi":{"hypothesis":"Using more of the 1s training budget for additional passes should improve raw denoising shape quality without increasing parameters.","learned":"Three passes cuts mean_raw_box_loss from 0.353 to 0.189 while max_training_s remains under the 1s gate at about 0.736s.","next_action_hint":"Try a less blunt improvement such as tuned learning rates or denoise schedule; avoid many more epochs because little headroom remains under 1s."}}
{"run":4,"commit":"4epochs","metric":0.121474676,"metrics":{"max_training_s":1.019045583,"mean_training_s":0.992418486,"noise_loss":0.44365},"status":"checks_failed","description":"Train DDPM for four dataset passes per model","timestamp":1779990326961,"segment":0,"confidence":1.9999999999999996,"asi":{"hypothesis":"A fourth pass may further reduce raw box loss while still being near the 1s budget.","learned":"Four passes improves raw loss to 0.121 but violates the hard gate with max_training_s about 1.019s.","rollback_reason":"The primary metric improved, but the per-model training time exceeded the 1s constraint.","next_action_hint":"Find efficiency improvements or hyperparameters that recover some of the four-pass loss benefit while keeping three-pass training under 1s."}}
{"run":5,"commit":"b516d34","metric":0.16915554,"metrics":{"max_training_s":0.894039625,"mean_training_s":0.8209727916666667,"noise_loss":0.6256333},"status":"keep","description":"Scale DDPM training learning rate by 1.25","timestamp":1779990367582,"segment":0,"confidence":2.7334925715485694,"asi":{"hypothesis":"A modestly larger effective step size may approach the four-pass quality while preserving the three-pass runtime budget.","learned":"Scaling η by 1.25 improves raw loss from 0.189 to 0.169 with max_training_s 0.894s, still under the gate; noise loss changes little.","next_action_hint":"Explore slightly higher or process-specific step scaling, but watch for instability and runtime variance near the 1s gate."}}
{"run":6,"commit":"eta150","metric":1.4653181,"metrics":{"max_training_s":0.7526425,"mean_training_s":0.717320125,"noise_loss":1.4354709},"status":"discard","description":"Scale DDPM training learning rate by 1.5","timestamp":1779990400976,"segment":0,"confidence":2,"asi":{"hypothesis":"A larger step size might reduce loss faster within the fixed three passes.","learned":"η scale 1.5 is unstable for this workload: raw box loss worsens badly to 1.465 and noise_loss rises to 1.435.","rollback_reason":"Primary metric regressed substantially versus best 0.169.","next_action_hint":"Search below 1.5, e.g. 1.3 or 1.35, or use process-specific scaling instead of a global increase."}}
{"run":7,"commit":"eta135","metric":0.18013346,"metrics":{"max_training_s":0.74412375,"mean_training_s":0.7304406803333333,"noise_loss":0.755517},"status":"discard","description":"Scale DDPM training learning rate by 1.35","timestamp":1779990433137,"segment":0,"confidence":2.7334925715485694,"asi":{"hypothesis":"A step scale between 1.25 and 1.5 might beat 1.25 without destabilizing.","learned":"η scale 1.35 regresses raw box loss to 0.180, worse than 1.25's 0.169; instability starts before 1.5.","rollback_reason":"Primary metric worsened relative to the kept best.","next_action_hint":"Try a smaller local search around 1.2–1.3 or change architecture/denoising rather than raising η further."}}
{"run":8,"commit":"6975db3","metric":0.121453345,"metrics":{"max_training_s":0.776488542,"mean_training_s":0.7440079860000001,"noise_loss":0.613949},"status":"keep","description":"Add a short fourth pass over 32 examples","timestamp":1779990491806,"segment":0,"confidence":3.6764241873080583,"asi":{"hypothesis":"The four-pass run showed much better raw box loss but exceeded the 1s gate; a small extra pass over part of the dataset should capture some late-training benefit while staying under budget.","learned":"Three full passes plus 32 extra examples matches the four-pass raw loss (~0.121) while keeping max_training_s at 0.776s, well under the 1s gate.","next_action_hint":"Validate this is not sample-order overfitting by trying a small fourth-pass subset from a different slice or a deterministic shuffled prefix; if stable, consider modest extra subset size or process-specific subsets."}}
{"run":9,"commit":"spread-","metric":0.13245861,"metrics":{"max_training_s":0.786111625,"mean_training_s":0.7501128333333335,"noise_loss":0.60734135},"status":"discard","description":"Use evenly spaced examples for the short fourth pass","timestamp":1779990544076,"segment":0,"confidence":3.9448027937299224,"asi":{"hypothesis":"Replacing the first 32 examples with an evenly spaced subset for the short fourth pass should improve coverage and reduce sample-order overfitting.","learned":"The evenly spaced 33-example extra pass worsened raw box loss to 0.132 despite slightly lower noise_loss; the first 32 examples performed better on the raw shape objective.","rollback_reason":"Primary metric regressed relative to kept best 0.121453345.","next_action_hint":"Try increasing the extra prefix size moderately while staying under 1s, or test a late-dataset slice to distinguish order effects from useful additional optimization."}}
{"run":10,"commit":"extra64","metric":0.15899985,"metrics":{"max_training_s":0.839654542,"mean_training_s":0.7928721526666666,"noise_loss":0.5769384},"status":"discard","description":"Increase short fourth pass to 64 examples","timestamp":1779990587324,"segment":0,"confidence":4.853350162109848,"asi":{"hypothesis":"A larger partial fourth pass should use remaining runtime headroom to move closer to the full four-pass loss while preserving the 1s training gate.","learned":"Using 64 extra prefix examples lowers noise_loss but worsens raw box loss to 0.159 versus the 32-example best 0.121; more noise-prediction optimization does not monotonically improve raw shape quality.","rollback_reason":"Primary metric regressed relative to best kept 0.121453345.","next_action_hint":"Avoid simply adding more prefix examples; test denoising dynamics or a smaller extra subset/learning-rate schedule instead."}}
{"run":11,"commit":"8b9ee2e","metric":0.11678138,"metrics":{"max_training_s":0.779416875,"mean_training_s":0.7653635973333334,"noise_loss":0.50910336},"status":"keep","description":"Use half learning rate for short fourth pass","timestamp":1779990635791,"segment":0,"confidence":4.9510281525099895,"asi":{"hypothesis":"The short fourth pass helps raw shape quality, but a lower learning rate may refine the denoiser without overshooting or overfitting the prefix examples.","learned":"Half-rate extra pass improves mean_raw_box_loss from 0.12145 to 0.11678 and reduces noise_loss to 0.509 while staying under the 1s gate at 0.779s.","next_action_hint":"Search the extra-pass rate around 0.25–0.75η or test a small held-out-style slice to verify the gain is not prefix-specific."}}
{"run":12,"commit":"f3b6041","metric":0.11313354,"metrics":{"max_training_s":0.779100916,"mean_training_s":0.7613350136666667,"noise_loss":0.50765043},"status":"keep","description":"Use quarter learning rate for short fourth pass","timestamp":1779990678837,"segment":0,"confidence":5.625355864264684,"asi":{"hypothesis":"If the short extra pass is acting as refinement, an even smaller learning rate may reduce overshoot and improve raw box shape without changing runtime.","learned":"Quarter-rate extra pass improves mean_raw_box_loss from 0.11678 to 0.11313 with essentially unchanged training time and a slight noise_loss improvement.","next_action_hint":"Continue local search lower, e.g. 0.125η, or add a second tiny refinement pass only if runtime remains comfortably below 1s."}}
{"run":13,"commit":"fd63773","metric":0.11105899,"metrics":{"max_training_s":0.810219583,"mean_training_s":0.7640832776666667,"noise_loss":0.5178381},"status":"keep","description":"Use eighth learning rate for short fourth pass","timestamp":1779990720656,"segment":0,"confidence":6.4397921990342395,"asi":{"hypothesis":"The extra pass appears to work as gentle refinement; reducing from quarter-rate to eighth-rate may further avoid overshoot while preserving the useful prefix exposure.","learned":"Eighth-rate extra pass improves mean_raw_box_loss from 0.11313 to 0.11106 while remaining under the 1s gate at 0.810s, though noise_loss worsened slightly versus quarter-rate.","next_action_hint":"Try an even smaller extra-pass rate such as 0.0625η, but watch for diminishing returns since noise_loss is no longer improving."}}
{"run":14,"commit":"sixteen","metric":0.11226279,"metrics":{"max_training_s":0.821609458,"mean_training_s":0.7795814443333334,"noise_loss":0.53511244},"status":"discard","description":"Use sixteenth learning rate for short fourth pass","timestamp":1779990769580,"segment":0,"confidence":7.320130004890855,"asi":{"hypothesis":"Continuing to reduce the extra-pass learning rate may further improve gentle refinement if eighth-rate still overshoots.","learned":"Sixteenth-rate extra pass regresses mean_raw_box_loss to 0.11226 and worsens noise_loss to 0.535; eighth-rate appears near the useful lower bound for this refinement.","rollback_reason":"Primary metric worsened relative to best kept 0.11105899.","next_action_hint":"Stop lowering the extra-pass rate; try adding a second tiny refinement pass at eighth-rate or adjust denoise dynamics while preserving the 1s gate."}}
{"run":15,"commit":"second-","metric":0.11197549,"metrics":{"max_training_s":0.8264455,"mean_training_s":0.7745754996666667,"noise_loss":0.51786214},"status":"discard","description":"Add second tiny refinement pass over 16 examples","timestamp":1779990823880,"segment":0,"confidence":11.29887773708131,"asi":{"hypothesis":"A second very small refinement pass at the best eighth-rate might improve shape quality while using remaining runtime headroom.","learned":"Adding 16 more refinement examples regresses mean_raw_box_loss to 0.11198 with no noise_loss benefit; extra prefix refinement starts to overdo the shape objective.","rollback_reason":"Primary metric worsened relative to best kept 0.11105899.","next_action_hint":"Avoid stacking more prefix refinement; next try model/denoise dynamics or verify the eighth-rate result on a less prefix-specific extra slice."}}
{"run":16,"commit":"stratif","metric":1.6452103,"metrics":{"max_training_s":0.780864708,"mean_training_s":0.7714262223333334,"noise_loss":1.3193918},"status":"discard","description":"Use deterministic stratified timesteps during main training passes","timestamp":1779990873864,"segment":0,"confidence":7.194020902651558,"asi":{"hypothesis":"Covering timesteps deterministically across dataset passes should improve denoising coverage and reduce dependence on random timestep sampling.","learned":"Stratified cyclic timesteps are much worse for this setup: raw box loss jumps to 1.645 and noise_loss to 1.319. The stochastic timestep sampling is important for learning stable denoising here.","rollback_reason":"Primary metric regressed severely versus best kept 0.11105899.","next_action_hint":"Do not replace random timesteps with simple cyclic coverage; try denoise update scaling or architecture changes instead."}}
{"run":17,"commit":"multi-t","metric":0,"metrics":{"max_training_s":0.883951875,"mean_training_s":0.8554345696666666,"noise_loss":0},"status":"crash","description":"Inject time embedding into hidden layers 2 and 3","timestamp":1779990929820,"segment":0,"confidence":7.194020902651558,"asi":{"hypothesis":"Adding timestep conditioning to deeper convolution layers should help the denoiser adapt its noise prediction across diffusion steps with only a small parameter increase.","learned":"Deeper time injection caused divergence/NaNs in both noise_loss and mean_raw_box_loss despite staying under the runtime gate, likely due to overly strong unnormalized time bias across multiple layers.","rollback_reason":"Benchmark produced NaN primary metric, so the experiment is invalid.","next_action_hint":"If revisiting deeper time conditioning, use smaller initialized time weights or only one additional layer; otherwise try safer denoise dynamics."}}
{"run":18,"commit":"small-l","metric":0.13268656,"metrics":{"max_training_s":0.815285834,"mean_training_s":0.772758167,"noise_loss":0.55334896},"status":"discard","description":"Add small timestep embedding to layer 2","timestamp":1779990978744,"segment":0,"confidence":11.179789962533928,"asi":{"hypothesis":"A small extra timestep bias in the second convolution layer might improve time conditioning without the NaN instability seen from full deeper embeddings.","learned":"Small layer-2 time conditioning stayed stable but worsened raw box loss to 0.133 and noise_loss to 0.553, so the extra conditioning is not useful in this tiny model/training budget.","rollback_reason":"Primary metric regressed relative to best kept 0.11105899.","next_action_hint":"Avoid deeper time embedding for now; focus on reverse denoise scaling or low-risk training schedule adjustments."}}
{"run":19,"commit":"eta120-","metric":0,"metrics":{"max_training_s":0.818996375,"mean_training_s":0.7897309723333333,"noise_loss":0},"status":"crash","description":"Reduce main pass learning rate scale to 1.2","timestamp":1779991024821,"segment":0,"confidence":11.179789962533928,"asi":{"hypothesis":"The best 1.25 main learning-rate scale may be slightly aggressive; reducing it to 1.2 could improve stability while preserving the eighth-rate refinement.","learned":"Main scale 1.2 unexpectedly produced NaNs in the benchmark, so the retained 1.25 scale is not simply too high; this may reflect stochastic sensitivity with the current seeds.","rollback_reason":"Benchmark produced NaN primary metric and noise_loss.","next_action_hint":"Avoid broad main-rate retuning for now; safer next steps are small output/denoise scaling experiments or validation-focused harness improvements."}}
{"run":20,"commit":"last32-","metric":0.11116698,"metrics":{"max_training_s":0.812892041,"mean_training_s":0.7859708883333334,"noise_loss":0.51554275},"status":"discard","description":"Use last 32 examples for eighth-rate refinement","timestamp":1779991077457,"segment":0,"confidence":11.267297153721401,"asi":{"hypothesis":"Switching the short eighth-rate refinement from the first 32 examples to the last 32 tests whether the best result is prefix-specific and may improve coverage without increasing runtime.","learned":"Last-32 refinement nearly matches but does not beat the prefix best: raw box loss 0.11117 vs 0.11106. The refinement benefit is not exclusively from the first examples, but the original prefix remains slightly better for this metric.","rollback_reason":"Primary metric did not improve relative to best kept 0.11105899.","next_action_hint":"Avoid chasing dataset slice micro-tuning; try non-cheating denoising dynamics in the shared test/harness or broader validation before further schedule tweaks."}}
{"run":21,"commit":"narrow1","metric":0,"metrics":{"max_training_s":0.632605208,"mean_training_s":0.5973636803333333,"noise_loss":0},"status":"crash","description":"Narrow DDPM channels to 12-24-12","timestamp":1779991136934,"segment":0,"confidence":11.267297153721401,"asi":{"hypothesis":"A narrower DDPM might train faster and possibly regularize raw denoising, leaving runtime headroom for future extra passes without overfitting.","learned":"The 12-24-12 channel model is faster (max_training_s 0.633s) but diverges to NaN under the current learning-rate schedule, so the schedule is tuned to the wider 16-32-16 model.","rollback_reason":"Benchmark produced NaN primary metric and noise_loss.","next_action_hint":"If reducing width, also lower the main learning-rate scale; otherwise pursue denoise/sampling changes rather than channel shrinkage."}}
{"run":22,"commit":"249c680","metric":0.11010503,"metrics":{"max_training_s":0.814106708,"mean_training_s":0.7864221806666666,"noise_loss":0.5178381},"status":"keep","description":"Clamp raw denoised output to data range before box-loss evaluation","timestamp":1779991203434,"segment":0,"confidence":11.343456098753153,"asi":{"hypothesis":"The valid image domain is [-1,1], so clamping only the raw denoised output before evaluation/plotting may remove out-of-range reverse-process overshoot without projecting to a square or using reproduce as model output.","learned":"Output clamping gives a small primary improvement from 0.11106 to 0.11011 with unchanged noise_loss and still under the 1s training gate; this is a legitimate range constraint but should be validated visually and not confused with the square projection.","next_action_hint":"Try clamping during each reverse denoise step rather than only at the final output, or validate test visualization still shows raw output before reproduce."}}
{"run":23,"commit":"step-cl","metric":0.122771025,"metrics":{"max_training_s":0.797758625,"mean_training_s":0.7679358473333333,"noise_loss":0.5178381},"status":"discard","description":"Clamp sample after every reverse denoise step","timestamp":1779991263744,"segment":0,"confidence":14.710223849381572,"asi":{"hypothesis":"Keeping the reverse process inside the valid image domain at every denoising step may prevent out-of-range drift better than final-only clamping.","learned":"Per-step clamping worsens raw box loss to 0.12277, much worse than final-only clamping at 0.11011; intermediate values outside [-1,1] appear useful for the reverse dynamics, even though final output should be range-limited.","rollback_reason":"Primary metric regressed relative to best kept 0.11010503.","next_action_hint":"Keep final-only clamping; avoid hard constraints inside reverse steps. Next try gentler final transforms or training improvements instead."}}
{"run":24,"commit":"tanh-fi","metric":0.148903,"metrics":{"max_training_s":0.8096855,"mean_training_s":0.775981861,"noise_loss":0.5178381},"status":"discard","description":"Use tanh final range transform instead of clamp","timestamp":1779991338191,"segment":0,"confidence":11.400989496811656,"asi":{"hypothesis":"A smooth final tanh range constraint may improve over hard final clamping by preserving gradient-like ordering while mapping raw denoised outputs into [-1,1].","learned":"Final tanh is much worse than final clamp: raw box loss rises to 0.1489 while training metrics are unchanged. The hard saturation at valid pixel extremes is better for this box distribution than smooth compression.","rollback_reason":"Primary metric regressed relative to best kept 0.11010503.","next_action_hint":"Keep final hard clamp. Restore autoresearch.sh to final clamp before the next iteration because autoresearch files are preserved across discards."}}
{"run":25,"commit":"486c1d9","metric":0.10811145,"metrics":{"max_training_s":0.808079875,"mean_training_s":0.7709885556666668,"noise_loss":0.5178381},"status":"keep","description":"Scale reverse denoise noise subtraction by 0.9","timestamp":1779991399395,"segment":0,"confidence":14.368695824220405,"asi":{"hypothesis":"The learned noise predictor may over-subtract during deterministic reverse denoising, so slightly damping the predicted-noise removal could improve raw shape quality without changing training or using square projection.","learned":"A 0.9 reverse denoise scale improves mean_raw_box_loss from 0.11011 to 0.10811 while leaving training time and noise_loss effectively unchanged. This suggests reverse dynamics, not just training loss, are a useful optimization lever.","next_action_hint":"Locally search reverse denoise scale around 0.8–1.0, e.g. 0.8 or 0.95, with final hard clamp retained."}}
