{"run":26,"commit":"dba8063","metric":0.104117215,"metrics":{"max_training_s":0.822646459,"mean_training_s":0.7831344446666667,"noise_loss":0.5178381},"status":"keep","description":"Scale reverse denoise noise subtraction by 0.8","timestamp":1779991459389,"segment":0,"confidence":19.637893825159416,"asi":{"hypothesis":"The 0.9 reverse denoise scale improved raw shape quality, so further damping to 0.8 may better compensate for over-subtraction while keeping final clamping and training unchanged.","learned":"A 0.8 denoise scale improves mean_raw_box_loss from 0.10811 to 0.10412 with no training-loss change; damping the deterministic reverse update remains the strongest recent lever.","next_action_hint":"Continue local search downward, e.g. 0.7, but watch for under-denoising; also test 0.85/0.75 later to locate optimum."}}
